id,name,email,hospital,role,specialty,bio,submitted_at,status,status_updated_at,notes
uuid-123,Dr. John Smith,john.smith@cityhospital.com,City Hospital,Doctor,Cardiology,"Board-certified cardiologist with 15 years of experience in interventional cardiology. Specializes in complex coronary interventions and preventive cardiology.",2024-01-15T10:30:00Z,approved,2024-01-16T09:15:00Z,"Approved after thorough review of credentials and references."
uuid-456,Nurse Sarah Johnson,sarah.johnson@communityclinic.com,Community Clinic,Nurse,Pediatrics,"Registered nurse specializing in pediatric care with 8 years of experience. Certified in pediatric advanced life support.",2024-01-14T14:20:00Z,pending,,,
uuid-789,Dr. Michael Chen,michael.chen@generalhospital.com,General Hospital,Doctor,Emergency Medicine,"Emergency medicine physician with expertise in trauma care and critical care medicine. Board-certified in emergency medicine.",2024-01-13T16:45:00Z,approved,2024-01-14T11:30:00Z,"Approved - excellent credentials and references."
uuid-101,Administrator Lisa Brown,lisa.brown@healthcenter.com,Health Center,Administrator,Hospital Administration,"Healthcare administrator with MBA in Healthcare Management. 10 years of experience in hospital operations and quality improvement.",2024-01-12T09:15:00Z,rejected,2024-01-13T14:20:00Z,"Rejected - insufficient healthcare experience for this role."
uuid-202,Dr. Emily Davis,emily.davis@womenclinic.com,Women's Health Clinic,Doctor,Gynecology,"Obstetrician-gynecologist with specialization in high-risk pregnancies and minimally invasive surgery. 12 years of clinical experience.",2024-01-11T13:30:00Z,pending,,,
